{
  "schema_version": "5.0",
  "student": {
    "token": "*****",
    "token_hash8": "a1b2c3d4",
    "name": "Daniil Sazanov",
    "group": "DevNet"
  },
  "yang": {
    "ok": true
  },
  "webex": {
    "ok": true,
    "room_title_contains_hash8": true
  },
  "pt": {
    "ok": true,
    "empty_ticket_seen": true
  },
  "validation_passed": true
}
